Summary,Created,Updated,Last Viewed,Resolved,Labels,Description,Category,Review_Flag,Match_Details
Huxley-API-Deploy-CI-WebRole_V2_Main pipeline,22/08/2025 10:21,25/08/2025 14:24,,25/08/2025 14:24,,failing working with Alexey ,Release Effort,NO,API:1; Customer Support:1; Prod Errors:1; Release Effort:2
Silverfin,18/08/2025 21:29,25/08/2025 11:16,,,,"Silverin a MYOB partner has reported two main issues during their migration to TPAM via the AccountRight Public API: (1) Only Administrator users can select company files during the consent flow while normal users cannot proceed despite being able to view them and (2) repeated """"API key has exceeded the per-second rate limit"""" errors when using their new client ID. Troubleshooting to date has involved reviews of usage plans, client ID status, consent flow logic, and Apigee/API traffic routing. Slack Convo: [https://myob.slack.com/archives/CU4FWH6CA/p1755474060673489|https://myob.slack.com/archives/CU4FWH6CA/p1755474060673489|smart-link] h4. Issue 1: Consent Flow & Company File Selection * When performing the consent flow, only users with Administrator permissions can select a company file for authorization. * Normal users can see the list of company files but are blocked from selecting them. There is a related message above the dropdown (possibly for security). * This is a change from previous sandbox testing, where normal users could select company files. * Clarification sought on whether this is intentional for all third-party developers, or a configuration/security issue. h4. Issue 2: API Rate Limiting Errors * Partner receives the error: """"API key has exceeded the per-second rate limit"""", even after switching to a new client ID. * The team is unclear if the rate limit error source is Apigee or internal API enforcement. * New client ID provided: {{567a0735-4f8b-4058-a41b-1acc64341f9f}} * Previous client ID (from older dev environment): {{b7ff1ffc-d833-4ecc-a770-87fa5d78ded3}} (not compatible with new consent flow)",Feature Support,YES,API:4; Customer Support:1; Feature Support:6; Prod Errors:1; Prod/Test:2
SLO alert for 504 (Gateway timeouts),14/08/2025 09:57,19/08/2025 13:51,,19/08/2025 13:51,,h1. Description Since yesterday (13/08/2025) we began getting SLO alerts for 504 errors. We need to investigate if it’s a real issue (504 errors got worse) and our alerts are incorrectly configured.,Prod Errors,NO,Customer Support:1; Prod Errors:4
Fletcher Group - provide prod certificate,14/08/2025 08:41,25/08/2025 14:25,,25/08/2025 14:25,,"*Value Statement* As Fletcher Building Group is transitioning to Tradelink, for integration purposes they want access to a pre-prod key and a copy of their XML data along with clear insights into how our supplier feed customers are handled, so that we can efficiently test and ensure smooth functionality before going live with the integration. This will help streamline our operations and ensure system compatibility with Tradelink. *Acceptance Criteria* * The prod key is successfully provisioned and provided to Fletcher Building Group for integration testing. * Fletcher Building Group receives a valid copy of their XML data that conforms to the expected format * Documentation or guidelines regarding how supplier feed customers are handled are delivered to Fletcher Building Group and meet their clarity requirements. *Out of Scope* Live production access keys or setup (only pre-prod keys are in scope). * Edits or modifications to the XML data itself beyond standard format validation. * Updates from XML to JSON h3. Tech notes # Integrators guestlist - [https://github.com/MYOB-Technology/monopoly-docs/blob/master/app/src/support/supplier-feeds/certificate-management/installing-new-client-certificates.md#1-add-new-thumbprint-to-integrators-guestlist|https://github.com/MYOB-Technology/monopoly-docs/blob/master/app/src/support/supplier-feeds/certificate-management/installing-new-client-certificates.md#1-add-new-thumbprint-to-integrators-guestlist] # Installing new Client Certificate - [https://myobconfluence.atlassian.net/wiki/spaces/PAR/pages/9064415278/Installing+new+Client+Certificates#Testing-the-changes|https://myobconfluence.atlassian.net/wiki/spaces/PAR/pages/9064415278/Installing+new+Client+Certificates#Testing-the-changes|smart-link] # Cert Expiry Notifier - [https://myobconfluence.atlassian.net/wiki/spaces/SNSS/pages/8862105839/Certificate+Expiry+Notifier|https://myobconfluence.atlassian.net/wiki/spaces/SNSS/pages/8862105839/Certificate+Expiry+Notifier|smart-link] # Supplier Feed Documentation - [https://myobconfluence.atlassian.net/wiki/spaces/PAR/pages/1459782091/Supplier+Feeds+mutual+TLS+register+and+upgrade+instructions|https://myobconfluence.atlassian.net/wiki/spaces/PAR/pages/1459782091/Supplier+Feeds+mutual+TLS+register+and+upgrade+instructions|smart-link] # Contacts can be found in Partner contacts[https://myobconfluence.atlassian.net/wiki/spaces/PAR/pages/9064285250/Partner+Contacts#Reece-%2F-Actrol-%2F-Metalflex|https://myobconfluence.atlassian.net/wiki/spaces/PAR/pages/9064285250/Partner+Contacts#Reece-%2F-Actrol-%2F-Metalflex|smart-link]",Certificate,NO,API:1; Certificate:4; Customer Support:3; Feature Support:2; Other:1; Prod/Test:3; Supplier Feeds:2
EXP 30 Aug-  Ampol certificate renewal,14/08/2025 08:15,26/08/2025 10:09,,26/08/2025 10:09,,"{panel:bgColor=#deebff} Pull ticket into sprint early so we don’t run out of time to contact Supplier {panel} *As* a developer that is a custodian of Supplier Feeds *I want to* renew {{connect-digital-nonprod.ampol.com.au}} for nonprod environment *So that* it doesn’t expire and our relationship with Ampol continues smoothly. h3. In Scope *From Slack channel* Name: [connect-digital-nonprod.ampol.com.au|http://connect-digital-nonprod.ampol.com.au/] Thumbprint: b17aa748bdbd4f194fbc0469e9b781d0db0f1e05 Expiring on: 2025-08-09 09:59:59 +0000 UTC h3. To Do # Request certificate renewal from Ampol. Specifically, ask for the Thumbprint of the certificate. We don’t require the full certificate. *** Ampol we request from them. # Add thumbprint to Integrator’s guestlist. # Team test the certificate. # Add this certificate to the cert expiry notifier. # Update Supplier Feed documentation with its expiry and serial number. # Update any name and email contacts if required. h3. How to test To Do 4: follow Curl command, to receive 400 or 422 for successful. - [https://myobconfluence.atlassian.net/wiki/spaces/PAR/pages/9064415278/Installing+new+Client+Certificates#Testing-the-changes|https://myobconfluence.atlassian.net/wiki/spaces/PAR/pages/9064415278/Installing+new+Client+Certificates#Testing-the-changes|smart-link] h3. Release strategy # Notify relevant external contacts that prod certificate has been renewed. ## Email 1 notifying team about expiry, that they need to renew the certificate and send us the certificate thumbprint. ## Email 2: notify team that the thumbprint has been added to the Integrator’s guestlist and that they can begin testing. ## Email 3: When notified by the team that testing is successful, notify team that the old thumbprint has been removed from the guestlist. h3. Tech notes # Integrators guestlist - [https://github.com/MYOB-Technology/monopoly-docs/blob/master/app/src/support/supplier-feeds/certificate-management/installing-new-client-certificates.md#1-add-new-thumbprint-to-integrators-guestlist|https://github.com/MYOB-Technology/monopoly-docs/blob/master/app/src/support/supplier-feeds/certificate-management/installing-new-client-certificates.md#1-add-new-thumbprint-to-integrators-guestlist] # Installing new Client Certificate - [https://myobconfluence.atlassian.net/wiki/spaces/PAR/pages/9064415278/Installing+new+Client+Certificates#Testing-the-changes|https://myobconfluence.atlassian.net/wiki/spaces/PAR/pages/9064415278/Installing+new+Client+Certificates#Testing-the-changes|smart-link] # Cert Expiry Notifier - [https://myobconfluence.atlassian.net/wiki/spaces/SNSS/pages/8862105839/Certificate+Expiry+Notifier|https://myobconfluence.atlassian.net/wiki/spaces/SNSS/pages/8862105839/Certificate+Expiry+Notifier|smart-link] # Supplier Feed Documentation - [https://myobconfluence.atlassian.net/wiki/spaces/PAR/pages/1459782091/Supplier+Feeds+mutual+TLS+register+and+upgrade+instructions|https://myobconfluence.atlassian.net/wiki/spaces/PAR/pages/1459782091/Supplier+Feeds+mutual+TLS+register+and+upgrade+instructions|smart-link] # Contacts can be found in Partner contacts[https://myobconfluence.atlassian.net/wiki/spaces/PAR/pages/9064285250/Partner+Contacts#Reece-%2F-Actrol-%2F-Metalflex|https://myobconfluence.atlassian.net/wiki/spaces/PAR/pages/9064285250/Partner+Contacts#Reece-%2F-Actrol-%2F-Metalflex|smart-link]",Certificate,YES,Certificate:5; Customer Support:3; Feature Support:1; Other:1; Prod/Test:3; Release Effort:1; Supplier Feeds:2
Demo/test website is publicly available,11/08/2025 09:19,13/08/2025 10:13,,,boltsupport,"Website address: [https://developer-myob-website-preprod.svc.platform.myobdev.com/|https://developer-myob-website-preprod.svc.platform.myobdev.com/] This seems like our internal testing site that is public available. This is causing confusion for our clients and third party developers, as they are referring to the outdated content on this website. Please make this website private or decommission if not needed. ",Prod/Test,NO,Customer Support:2; Other:1; Prod/Test:5; Release Effort:1
Supplier Feeds - Misaligned ledger from supplier feeds,08/08/2025 15:02,19/08/2025 06:46,,19/08/2025 06:46,,*As* a developer *I want* to ensure that all supplier feeds are mapped correctly *So that* customers receive their data and we don’t share with other customers. Currently there is an issue where NZ migrations of SE may have overwritten the supplier feed connection. FILE GUID PAIRED: 7aa15a6f-75ed-490d-8d90-c6d254c81db6 FILE GUID THAT SHOULD BE PAIRED: 2962b091-c697-4214-9b6c-9c410cef14f0 |ledger|product|serial|supplierId|user| |7aa15a6f-75ed-490d-8d90-c6d254c81db6|ARL|614134293606|59cda73f-a955-496b-9823-9edebc8846df|[wedoservices2@gmail.com|mailto:wedoservices2@gmail.com]| File connected to above data- 2962b091-c697-4214-9b6c-9c410cef14f0 h3. Acceptance Criteria * -Remove current incorrectly paired supplier feed and insert the correct CFID as per above information.- DONE,Supplier Feeds,NO,Customer Support:1; Prod/Test:1; Supplier Feeds:5
E2E test failing for bank feed auto approval endpoint,08/08/2025 09:04,14/08/2025 09:57,08/08/2025 16:04,12/08/2025 10:10,,"We are getting follow error in the E2E test for CI release pipeline ([https://huxleybuild.myob.myobcorp.net/go/tab/build/detail/Huxley-API-Deploy-CI-WebRole_V2_257/14/BDDTestsV2/9/Latest-Banking|https://huxleybuild.myob.myobcorp.net/go/tab/build/detail/Huxley-API-Deploy-CI-WebRole_V2_257/14/BDDTestsV2/9/Latest-Banking]) as screenshot indicates. the expected value is 18 but the test return 8. The sparkle team suggested it could caused by the recent feature toggle change: [https://github.com/MYOB-Technology/AccountRightDeployV2/pull/2082/files|https://github.com/MYOB-Technology/AccountRightDeployV2/pull/2082/files] Stay in touch with sparkle team, and make sure the test error is resolved before {{2025-08-13}}. Error can be validate by rerun the pipeline. [https://myob.slack.com/archives/C01SXSDGRBP/p1754553698122349|https://myob.slack.com/archives/C01SXSDGRBP/p1754553698122349|smart-link]",Release Effort,NO,API:2; Bank Feeds:1; Customer Support:1; Prod Errors:3; Release Effort:3
Public API Tech release 25.7,07/08/2025 14:39,11/08/2025 06:56,,08/08/2025 08:56,,* Release public API 25.7 to Prod * Make sure pipelines are all green,Release Effort,NO,API:2; Customer Support:1; Prod/Test:1; Release Effort:2
Update email in API error message to apisupport@myob.com,07/08/2025 14:09,13/08/2025 09:07,,13/08/2025 09:07,boltsupport,"The email address for error messages returned via the API is currently [developers@myob.com|mailto:developers@myob.com]. This email address is no longer monitored since 2022. Can we please have the email address displayed in API error messages to the current [apisupport@myob.com|mailto:apisupport@myob.com] email address which will create a new support ticket in our zendesk ticketing queues. Example error message returned for generic 500 “Internal Server Error” {noformat}{ """"Errors"""": [ { """"Name"""": """"InternalError"""", """"Message"""": """"An exception was thrown that was not handled correctly. If this situation persists please contact developers@myob.com for further assistance."""", """"AdditionalDetails"""": null, """"ErrorCode"""": 20, """"Severity"""": """"Error"""", """"LearnMore"""": null } ], """"Information"""": """"Warning, error messages have not been finalised in this release and may change"""" }{noformat}",Prod Errors,NO,API:1; Other:1; Prod Errors:3; Prod/Test:1; Release Effort:1
Emailing from API fails with error SendingEmailIsBlocked (error code 400),06/08/2025 10:16,11/08/2025 10:19,08/08/2025 16:02,11/08/2025 10:18,boltsupport,When attempting to email an invoice out of the API the client is met with an error SendingEmailIsBlocked. * Happening for all emails via API * Can send emails OK via AccountRight and WebUI * SecOps have confirmed the file is not on a blacklist * Unable to reproduce on my end with DFR_Copy of file: Can send both from UI and via API ---- Example client 1: Sumo log _code=Y2eCiTrpyqBlQw6kDOpd2P9WJwlK7U5Dn4zDuus2 Company file ID: fce41828-4e41-428e-aa35-1f7d31bd4afc Endpoint example: /Sale/Invoice/Item/5a0fcf27-45a3-49d2-9ea9-9cf46eb3ee9a/Email API Key: 30bfa95b-a82a-49d1-b324-a6d74f6cdde8 [https://myobapi.zendesk.com/agent/tickets/45757|https://myobapi.zendesk.com/agent/tickets/45757] ---- Example client 2: sumo code _code=2jSifv9J4QZTCny438DTNCjmqEFIVV9OKQsYOp0H Company file ID: 1647cc92-2ee1-4c32-bcb4-ab70ffa92800 Example endpoint: /Sale/Invoice/Item/e8831557-3e9a-494c-9842-bc8013463426/Email API Key: 744395f7-a6fd-4b74-a65b-e8271af26df8 [https://myobapi.zendesk.com/agent/tickets/45991|https://myobapi.zendesk.com/agent/tickets/45991],API,NO,API:3; Customer Support:1; Prod Errors:2; Prod/Test:1
ConsentWeb [Critical] Dependabot Vuln – Predictable Boundary in form-data,29/07/2025 09:32,19/08/2025 15:23,,19/08/2025 15:23,,"[https://github.com/MYOB-Technology/business-api-consent-web/security/dependabot/30|https://github.com/MYOB-Technology/business-api-consent-web/security/dependabot/30] h3. Remediation SLA - Critical Triage SLA : 8 hours (/) | Remediation SLA : 1 day Dependabot uses [WIZ SLAs and Due Dates|https://myobconfluence.atlassian.net/wiki/spaces/security/pages/8742535904/Dependabot+Usage+Standard]. h3. Summary A critical security vulnerability (CVSS 9.4/10) has been identified in the form-data npm module (v4.0.1), affecting multiple projects in our dependency tree, including business-api-consent-web. The vulnerability arises because form-data uses JavaScript’s Math.random() to generate multipart form boundaries. Since Math.random() is a pseudo-random number generator (PRNG) and predictable under certain conditions, an attacker who can observe a sequence of its outputs may infer future values and thus predict the multipart boundary. This opens the door to injection attacks, particularly if the application sends user-controlled input via form-data. The vulnerability maps to CWE-330: Use of Insufficiently Random Values. h3. Customer Value Statement Remediating this vulnerability protects confidential customer data, maintains data integrity, and preserves trust in MYOB's platforms. Addressing critical security findings ensures compliance with industry best practices, minimizes exposure to targeted attacks, and demonstrates continued commitment to the security of our customers’ information. ---- h3. Solution * *Upgrade or Patch:* Identify and upgrade all dependencies introducing form-data v4.0.1 (including, but not limited to, @vitest/coverage-v8, axios, cypress, jsdom, and vitest) to a secure version where the vulnerability is addressed. * *Monitor Downstream Fixes:* If a direct update is not yet available in top-level dependencies, monitor upstream projects and contribute/advocate for timely patching. * *Work Around:* As an interim mitigation, avoid sending user-controlled input using form-data when possible, or restrict exposure of Math.random()-generated outputs in server responses to minimize the risk of state prediction by attackers. ---- h3. Technical Documentation Risk Assesment: [https://myobconfluence.atlassian.net/wiki/spaces/SPPA/pages/10622926873/BOL-659+-+Dependabot+Vuln+Predictable+Boundary+in+form-data|https://myobconfluence.atlassian.net/wiki/spaces/SPPA/pages/10622926873/BOL-659+-+Dependabot+Vuln+Predictable+Boundary+in+form-data|smart-link]",Customer Support,YES,API:1; Customer Support:3; Feature Support:1; Other:3; Prod Errors:1; Prod/Test:1; Security:2
Broken pipeline Huxley-API-Deploy-CI-WebRole_Mainline,24/07/2025 10:43,07/08/2025 16:17,,28/07/2025 10:12,,"h2. Description Multiple tests in Huxley-API-Deploy-CI-WebRole_V2_Main E2E pipeline return 404 eror with the following HTML content. E.g. GET {{https://pub.api.myobdev.com/accountright-ci-mainline/ce95e58a-650b-49c3-a0f0-0e5484874440/Banking/BankFeeds/AutoApproval}}: {quote}{{""""<!DOCTYPE html PUBLIC \""""-//W3C//DTD XHTML 1.0 Strict//EN\"""" \""""http://www.w3.org/TR/xhtml1/DTD/xhtml1-strict.dtd\"""">\r\n<html xmlns=\""""http://www.w3.org/1999/xhtml\"""">\r\n<head>\r\n<meta http-equiv=\""""Content-Type\"""" content=\""""text/html; charset=iso-8859-1\""""/>\r\n<title>404 - File or directory not found.</title>\r\n<style type=\""""text/css\"""">\r\n<!--\r\nbody{margin:0;font-size:.7em;font-family:Verdana, Arial, Helvetica, sans-serif;background:#EEEEEE;}\r\nfieldset{padding:0 15px 10px 15px;} \r\nh1{font-size:2.4em;margin:0;color:#FFF;}\r\nh2{font-size:1.7em;margin:0;color:#CC0000;} \r\nh3{font-size:1.2em;margin:10px 0 0 0;color:#000000;} \r\n#header{width:96%;margin:0 0 0 0;padding:6px 2% 6px 2%;font-family:\""""trebuchet MS\"""", Verdana, sans-serif;color:#FFF;\r\nbackground-color:#555555;}\r\n#content{margin:0 0 0 2%;position:relative;}\r\n.content-container{background:#FFF;width:96%;margin-top:8px;padding:10px;position:relative;}\r\n-->\r\n</style>\r\n</head>\r\n<body>\r\n<div id=\""""header\""""><h1>Server Error</h1></div>\r\n<div id=\""""content\"""">\r\n <div class=\""""content-container\""""><fieldset>\r\n <h2>404 - File or directory not found.</h2>\r\n <h3>The resource you are looking for might have been removed, had its name changed, or is temporarily unavailable.</h3>\r\n </fieldset></div>\r\n</div>\r\n</body>\r\n</html>\r\n}}{quote} h2. References [https://huxleybuild.myob.myobcorp.net/go/tab/build/detail/Huxley-API-Deploy-CI-WebRole_V2_Main/1248/BDDTestsV2/6/Latest-Banking|https://huxleybuild.myob.myobcorp.net/go/tab/build/detail/Huxley-API-Deploy-CI-WebRole_V2_Main/1248/BDDTestsV2/6/Latest-Banking]",Release Effort,NO,API:1; Customer Support:1; Prod Errors:1; Prod/Test:1; Release Effort:2
Rotate *.dev.ar-services.myob.com certificate in CI environment,23/07/2025 16:00,30/07/2025 12:26,,30/07/2025 12:16,,"h2. Description We use {{wildcard-dev-ar-services-myob-com}} certificate in {{ci-eau-arlapikeyvault}} keyvault to install to our Public API cloud services. This certificate has expired, which is causing all Public API E2E tests to fail. We need to copy that certificate from the SIT key vault - {{sit-eau-arkeyvault}}. h2. Acceptance Criteria # The new version of {{wildcard-dev-ar-services-myob-com}} certificate is installed in {{ci-eau-arlapikeyvault}} key vault. # Public API E2E testing pipeline can successfully deploy API to both CI_MAINLINE and CI_RELEASE environment. # E2E tests do not fail because of the certificate verification.",Release Effort,YES,API:3; Certificate:2; Customer Support:1; Other:1; Prod Errors:1; Prod/Test:3; Release Effort:3
SIT Public API Certificate Failure Report,21/07/2025 15:15,23/07/2025 17:00,,23/07/2025 17:00,,"h3. Value Statement Removing the old ARL Huxley version from the API will improve system stability, reduce complexity in support and development, and ensure that only supported and secure versions are operational. This aligns with continuous delivery goals and supports the Bolt Support team's ability to maintain and monitor the API efficiently. h3. User Story *As a* Bolt Support team member, *I want* the old version (25.5) of ARL Huxley to be decommissioned from the API, *so that* we streamline support efforts by removing outdated version dependencies and reduce maintenance overhead. Follow [https://myobconfluence.atlassian.net/wiki/spaces/SPPA/pages/2139062666/Decommission+Huxley+version+from+API|https://myobconfluence.atlassian.net/wiki/spaces/SPPA/pages/2139062666/Decommission+Huxley+version+from+API|smart-link] to complete decommission 25.4 from public API. and deploy decommission changes to Prod",Release Effort,NO,API:2; Certificate:1; Other:2; Prod Errors:1; Prod/Test:2; Release Effort:2
Public API Decommission 25.6 (18th August),17/07/2025 07:19,20/08/2025 12:32,,20/08/2025 12:32,,"h3. Value Statement Removing the old ARL Huxley version from the API will improve system stability, reduce complexity in support and development, and ensure that only supported and secure versions are operational. This aligns with continuous delivery goals and supports the Bolt Support team's ability to maintain and monitor the API efficiently. h3. User Story *As a* Bolt Support team member, *I want* the old version (25.5) of ARL Huxley to be decommissioned from the API, *so that* we streamline support efforts by removing outdated version dependencies and reduce maintenance overhead. Follow [https://myobconfluence.atlassian.net/wiki/spaces/SPPA/pages/2139062666/Decommission+Huxley+version+from+API|https://myobconfluence.atlassian.net/wiki/spaces/SPPA/pages/2139062666/Decommission+Huxley+version+from+API|smart-link] to complete decommission 25.4 from public API. and deploy decommission changes to Prod",Release Effort,NO,API:2; Other:2; Prod/Test:1; Release Effort:2
Public API minor patch release,15/07/2025 08:49,16/07/2025 10:06,,15/07/2025 18:08,,One of the test is failing in 25.6 release pipeline however we got the approval from Charles to go ahead and fix it later. And this is the patch release that fix the test/error. [https://myob.slack.com/archives/C018EA740D7/p1751927999598969|https://myob.slack.com/archives/C018EA740D7/p1751927999598969],Release Effort,NO,API:2; Customer Support:1; Other:1; Prod Errors:2; Release Effort:2
Public API Decommission 25.5 (21st July),14/07/2025 07:54,23/07/2025 12:18,,23/07/2025 12:18,,"h3. Value Statement Removing the old ARL Huxley version from the API will improve system stability, reduce complexity in support and development, and ensure that only supported and secure versions are operational. This aligns with continuous delivery goals and supports the Bolt Support team's ability to maintain and monitor the API efficiently. h3. User Story *As a* Bolt Support team member, *I want* the old version (25.5) of ARL Huxley to be decommissioned from the API, *so that* we streamline support efforts by removing outdated version dependencies and reduce maintenance overhead. Follow [https://myobconfluence.atlassian.net/wiki/spaces/SPPA/pages/2139062666/Decommission+Huxley+version+from+API|https://myobconfluence.atlassian.net/wiki/spaces/SPPA/pages/2139062666/Decommission+Huxley+version+from+API|smart-link] to complete decommission 25.4 from public API. and deploy decommission changes to Prod",Release Effort,NO,API:2; Other:2; Prod/Test:1; Release Effort:2
Grant access to the Public API for OIP Merchant SignUp Service,11/07/2025 16:59,14/07/2025 14:21,,14/07/2025 14:21,,"SIT is granted. 11/07 PROD needs to be granted. Waiting for comms that SIT was successful. Prod command: {{myob-id admin clients grant --id accountright-public-api --sub oip-merchant-sign-up-service --name """"Allow OIP Merchant SignUp Service access Public API"""" --scopes '[{""""name"""":""""CompanyFile"""", """"desc"""": """"Can access all endpoints"""", """"type"""": """"app""""}]' --provider ids -P}} Tech notes: [https://myobconfluence.atlassian.net/wiki/spaces/SPPA/pages/10551690056/SME+Public+API+Authentication+With+M2M+Tokens|https://myobconfluence.atlassian.net/wiki/spaces/SPPA/pages/10551690056/SME+Public+API+Authentication+With+M2M+Tokens|smart-link] Slack support convo: [https://myob.slack.com/archives/CU4FWH6CA/p1752126029186579|https://myob.slack.com/archives/CU4FWH6CA/p1752126029186579|smart-link]",API,NO,API:3; Access Requests:2; Customer Support:2; Feature Support:1; Prod/Test:2
